name,lat,lon,land,Facebook,infoArches National Park,38.68,-109.57,309.7,253550,This site features more than 2,000 natural sandstone arches, including the famous Delicate Arch. In a desert climate, millions of years of erosion have led to these structures, and the arid ground has life-sustaining soil crust and potholes, which serve as natural water-collecting basins. Other geologic formations are stone columns, spires, fins, and towersBryce Canyon National Park Utah,37.57,-112.18,145.0,18647,Bryce Canyon is a giant geological amphitheater on the Paunsaugunt Plateau. The unique area has hundreds of tall sandstone hoodoos formed by erosion. The region was originally settled by Native Americans and later by Mormon pioneers.Canyonlands National Park Utah,38.2,-109.93,1366.2,177583,This landscape was eroded into a maze of canyons, buttes, and mesas by the combined efforts of the Colorado River, Green River, and their tributaries, which divide the park into three districts. There are rock pinnacles and other naturally sculpted rock formations, as well as artifacts from Ancient Pueblo peoplesCapitol Reef National Park Utah,38.20,-111.17,979.0,14040,The park's Waterpocket Fold is a 100-mile (160 km) monocline that exhibits the earth's diverse geologic layers. Other natural features are monoliths, sandstone domes, and cliffs shaped like the United States CapitolZion National Park Utah,37.30,-113.05,593.3,265359,Located at the junction of the Colorado Plateau, Great Basin, and Mojave Desert, this geological wonder has colorful sandstone canyons, mountainous mesas, and countless rock towers. Natural arches and exposed plateau formations compose a large wilderness roughly divided into four ecosystems: desert, riparian, woodland, and coniferous forest.Grand Canyon National Park Arizona,36.06,-112.14,4926.7,262031,The Grand Canyon, carved by the mighty Colorado River, is 277 miles (446 km) long, up to 1 mile (1.6 km) deep, and up to 15 miles (24 km) wide. Millions of years of erosion have exposed the colorful layers of the Colorado Plateau in countless mesas and canyon walls, visible from both the north and south rims, or from a number of trails that descend into the canyon itselfMesa Verde National Park Colorado,37.18,-108.49,210.9,14562,This area constitutes over 4,000 archaeological sites of the Ancestral Puebloan people, who lived here and elsewhere in the Four Corners region for at least 700 years. Cliff dwellings built in the 12th and 13th centuries include the famous Cliff Palace, which has 150 rooms and 23 kivas, and the Balcony House, with its many passages and tunnels