name,lat,lon,land,Facebook,reviews,infoArches,38.68,-109.57,309.7,253550,4.8,This site features more than 2,000 natural sandstone arches, including the famous Delicate Arch. In a desert climate, millions of years of erosion have led to these structures, and the arid ground has life-sustaining soil crust and potholes, which serve as natural water-collecting basins. Other geologic formations are stone columns, spires, fins, and towersBryce Canyon-UT,37.57,-112.18,145.0,18647,4.7,Bryce Canyon is a giant geological amphitheater on the Paunsaugunt Plateau. The unique area has hundreds of tall sandstone hoodoos formed by erosion. The region was originally settled by Native Americans and later by Mormon pioneers.Canyonlands-UT,38.2,-109.93,1366.2,177583,4.7,This landscape was eroded into a maze of canyons, buttes, and mesas by the combined efforts of the Colorado River, Green River, and their tributaries, which divide the park into three districts. There are rock pinnacles and other naturally sculpted rock formations, as well as artifacts from Ancient Pueblo peoplesCapitol Reef-UT,38.20,-111.17,979.0,14040,4.5,The park's Waterpocket Fold is a 100-mile (160 km) monocline that exhibits the earth's diverse geologic layers. Other natural features are monoliths, sandstone domes, and cliffs shaped like the United States CapitolZion-UT,37.30,-113.05,593.3,265359,4.7,Located at the junction of the Colorado Plateau, Great Basin, and Mojave Desert, this geological wonder has colorful sandstone canyons, mountainous mesas, and countless rock towers. Natural arches and exposed plateau formations compose a large wilderness roughly divided into four ecosystems: desert, riparian, woodland, and coniferous forest.Grand Canyon,36.06,-112.14,4926.7,262031,4.7,The Grand Canyon, carved by the mighty Colorado River, is 277 miles (446 km) long, up to 1 mile (1.6 km) deep, and up to 15 miles (24 km) wide. Millions of years of erosion have exposed the colorful layers of the Colorado Plateau in countless mesas and canyon walls, visible from both the north and south rims, or from a number of trails that descend into the canyon itselfAcadia,44.35,-68.21,191.8,20869,4.6,Covering most of Mount Desert Island and other coastal islands, Acadia features the tallest mountain on the Atlantic coast of the United States, granite peaks, ocean shoreline, woodlands, and lakes. There are freshwater, estuary, forest, and intertidal habitats.Badlands,43.75,-102.50,982.4,39990,4.9,The Badlands are a collection of buttes, pinnacles, spires, and grass prairies. It has the world's richest fossil beds from the Oligocene epoch, and the wildlife includes bison, bighorn sheep, black-footed ferrets, and swift foxes.Big Bend,29.25,-103.25,3242.2,9659,4.7,Named for the prominent bend in the Rio Grande along the US–Mexico border, this park encompasses a large and remote part of the Chihuahuan Desert. Its main attraction is backcountry recreation in the arid Chisos Mountains and in canyons along the river. A wide variety of Cretaceous and Tertiary fossils as well as cultural artifacts of Native Americans also exist within its borders.Biscayne,25.65,-80.08,699.8,9212,4.4,Located in Biscayne Bay, this park at the north end of the Florida Keys has four interrelated marine ecosystems: mangrove forest, the Bay, the Keys, and coral reefs. Threatened animals include the West Indian manatee, American crocodile, various sea turtles, and peregrine falcon.Black Canyon,38.57,-107.72,133.3,11348,4.8,The park protects a quarter of the Gunnison River, which slices sheer canyon walls from dark Precambrian-era rock. The canyon features incredibly steep descents, and is a popular site for river rafting and rock climbing. The deep, narrow canyon, made of gneiss and schist, is often in shadow and therefore appears black.Carlsbad Caverns,32.17,-104.44,189.3,23986,4.8,Carlsbad Caverns has 117 caves, the longest of which is over 120 miles (190 km) long. The Big Room is almost 4,000 feet (1,200 m) long, and the caves are home to over 400,000 Mexican free-tailed bats and sixteen other species. Above ground are the Chihuahuan Desert and Rattlesnake Springs..Channel Islands,34.01,-119.42,1009.9,12783,4.5,Five of the eight Channel Islands are protected, and half of the park's area is underwater. The islands have a unique Mediterranean ecosystem originally settled by the Chumash people. They are home to over 2,000 species of land plants and animals, and 145 are unique to them, including the island fox. Professional ferry services offer transportation to the islands from the mainland..Congaree,33.78,-80.78,107.4,2373,4.5,On the Congaree River, this park is the largest portion of old-growth floodplain forest left in North America. Some of the trees are the tallest in the Eastern US. An elevated walkway called the Boardwalk Loop guides visitors through the swamp.Crater Lake,42.94,-122.1,741.5,172724,4.7,Crater Lake lies in the caldera of an ancient volcano called Mount Mazama that collapsed 7,700 years ago. It is the deepest lake in the United States and is famous for its vivid blue color and water clarity. There are two more recent volcanic islands in the lake, and, with no inlets or outlets, all water comes through precipitation..Cuyahoga Valley,41.24,-81.55,133.0,12898,4.7,This park along the Cuyahoga River has waterfalls, hills, trails, and exhibits on early rural living. The Ohio and Erie Canal Towpath Trail follows the Ohio and Erie Canal, where mules towed canal boats. The park has numerous historic homes, bridges, and structures,[21] and also offers a scenic train ride.Death Valley,36.24,-116.82,13647.6,71476,4.5,Death Valley is the hottest, lowest, and driest place in the United States. Daytime temperatures have topped 130 °F (54 °C) and it is home to Badwater Basin, the lowest elevation in North America. A diversity of colorful canyons, desolate badlands, shifting sand dunes, sprawling mountains, and over 1000 species of plants populate this geologic graben. Additional points of interest include salt flats, historic mines, and springs.Denali,63.33,-150.50,19185.8,232040,4.5,Centered around Denali, the tallest mountain in North America, Denali is serviced by a single road leading to Wonder Lake. Denali and other peaks of the Alaska Range are covered with long glaciers and boreal forest. Wildlife includes grizzly bears, Dall sheep, caribou, and gray wolves.Dry Tortugas,24.63,-82.87,261.8,14629,4.5,The islands of the Dry Tortugas, at the westernmost end of the Florida Keys, are the site of Fort Jefferson, a Civil War-era fort that is the largest masonry structure in the Western Hemisphere. With most of the park being remote ocean, it is home to undisturbed coral reefs and shipwrecks and is only accessible by plane or boat.Everglades,25.32,-80.93,6104.8,37574,4.4,The Everglades are the largest subtropical wilderness in the United States. This mangrove ecosystem and marine estuary is home to 36 protected species, including the Florida panther, American crocodile, and West Indian manatee. Some areas have been drained and developed; restoration projects aim to restore the ecology.Gates of the Arctic,67.78,-153.30,30448.1,17989,4.2,The country's northernmost park protects an expanse of pure wilderness in Alaska's Brooks Range and has no park facilities. The land is home to Alaska natives, who have relied on the land and caribou for 11,000 years.Glacier,48.80,-114.00,4101.8,510227,4.8,The U.S. half of Waterton-Glacier International Peace Park, this park hosts 26 glaciers and 130 named lakes beneath a stunning canopy of Rocky Mountain peaks. There are historic hotels and a landmark road in this region of rapidly receding glaciers. The local mountains, formed by an overthrust, expose the world's best-preserved sedimentary fossils from the Proterozoic era.Glacier Bay,58.50,-137.00,13050.5,31331,4.4,lacier Bay has numerous tidewater glaciers, mountains, fjords, and a temperate rainforest, and is home to large populations of grizzly bears, mountain goats, whales, seals, and eagles. When discovered in 1794 by George Vancouver, the entire bay was covered in ice, but the glaciers have since receded more than 65 miles (105 km).Grand Teton,43.73,-110.80,1254.5,391095,4.8,Grand Teton is the tallest mountain in the Teton Range. The park's historic Jackson Hole and reflective piedmont lakes teem with unique wildlife and contrast with the dramatic mountains, which rise abruptly from the sage-covered valley below.Great Basin,38.98,-114.30,312.3,14973,4.7,Based around Nevada's second tallest mountain, Wheeler Peak, Great Basin National Park contains 5,000-year-old bristlecone pines, a rock glacier, and the limestone Lehman Caves. It also enjoys some of the country's darkest night skies. Animals which call the park home include Townsend's big-eared bat, pronghorn, and Bonneville cutthroat trout.Great Sand Dunes,37.73,-105.51,173.9,23141,4.6,The tallest sand dunes in North America, up to 750 feet (230 m) tall, were formed by deposits of the ancient Rio Grande in the San Luis Valley. Abutting a variety of grasslands, shrublands, and wetlands, the park also has alpine lakes, six 13,000-foot mountains, and old-growth forests.Great Smoky Mountains,35.68,-83.53,2110.4,558053,4.7,The Great Smoky Mountains, part of the Appalachian Mountains, span a wide range of elevations, making them home to over 400 vertebrate species, 100 tree species, and 5000 plant species. Hiking is the park's main attraction, with over 800 miles (1,300 km) of trails, including 70 miles (110 km) of the Appalachian Trail. Other activities include fishing, horseback riding, and touring nearly 80 historic structures.Guadalupe Mountains,31.92,-104.87,349.7,2210,4.5,This park boasts Guadalupe Peak, the highest point in Texas; the scenic McKittrick Canyon filled with bigtooth maples; a corner of the arid Chihuahuan Desert; and a fossilized coral reef from the Permian era.Haleakala,20.72,-156.17,117.7,12489,4.6,The Haleakalā volcano on Maui features a very large crater with numerous cinder cones, Hosmer's Grove of alien trees, the Kipahulu section's scenic pools of freshwater fish, and the native Hawaiian goose. It is home to the greatest number of endangered species within a U.S. National Park.Hawaii Volcanoes,19.38,-155.20,1308.9,2238,4.5,This park on the Big Island protects the famous Kīlauea and Mauna Loa volcanoes, two of the world's most active geological features. Diverse ecosystems range from tropical forests at sea level to barren lava beds at more than 13,000 feet (4,000 m).Hot Springs,34.51,-93.05,22.5,4026,4.2,Hot Springs was established by act of congress as a federal reserve on April 20, 1832, as such it is the oldest park managed by the National Park Service. Congress changed the reserve's designation to National Park on March 4, 1921 after the National Park Service was established in 1916. Amid some controversy, using 1921 as its official established date is inconsistent considering Yellowstone and other parks still readily use their pre-National Park Service dates, yet were not officially national parks at the time of their establishment.[38] Hot Springs is the smallest and only National Park in an urban area and is based around natural hot springs that flow out of the low lying Ouachita Mountains. The springs provide opportunities for relaxation in an historic setting; Bathhouse Row preserves numerous examples of 19th-century architecture.Isle Royale,48.10,-88.55,2314.0,8139,4.5,The largest island in Lake Superior is a place of isolation and wilderness. Along with its many shipwrecks, waterways, and hiking trails, the park also includes over 400 smaller islands within 4.5 miles (7.2 km) of its shores. There are only 20 mammal species on the entire island, though the relationship between its wolf and moose populations is especially unique.Joshua Tree,33.79,-115.90,3196.0,82694,4.6,Covering large areas of the Colorado and Mojave Deserts and the Little San Bernardino Mountains, this exotic desert landscape is populated by vast stands of the famous Joshua tree. Great changes in elevation reveal starkly contrasting environments including bleached sand dunes, dry lakes, rugged mountains, and maze-like clusters of monzogranite monoliths.Katmai,58.50,-155.00,14870.3,20452,0,This park on the Alaska Peninsula protects the Valley of Ten Thousand Smokes, an ash flow formed by the 1912 eruption of Novarupta, as well as Mount Katmai. Over 2,000 grizzly bears come here each year to catch spawning salmon. Other wildlife includes caribou, wolves, moose, and wolverines.Kenai Fjords,59.92,-149.65,2711.3,29045,4.5,Near Seward on the Kenai Peninsula, this park protects the Harding Icefield and at least 38 glaciers and fjords stemming from it. The only area accessible to the public by road is Exit Glacier; the rest must be viewed from boat tours.Kings Canyon,36.80,-118.55,1869.2,247878,4.8,Home to several giant sequoia groves and the General Grant Tree, the world's second largest, this park also features part of the Kings River, sculptor of the dramatic granite canyon that is its namesake, and the San Joaquin River, as well as Boyden Cave.Kobuk Valley,67.55,-159.28,7084.9,1926,4.2,Kobuk Valley protects 61 miles (98 km) of the Kobuk River and three regions of sand dunes. Created by glaciers, the Great Kobuk, Little Kobuk, and Hunt River Sand Dunes can reach 100 feet (30 m) high and 100 °F (38 °C), and they are the largest dunes in the Arctic. Twice a year, half a million caribou migrate through the dunes and across river bluffs that expose well-preserved ice age fossils.Lake Clark,60.97,-153.42,10601.7,13310,4.3,The region around Lake Clark features four active volcanoes, including Mount Redoubt, as well as an abundance of rivers, glaciers, and waterfalls. Temperate rainforests, a tundra plateau, and three mountain ranges fill in the remaining landscape.Lassen Volcanic,40.49,-121.51,430.5,23820,4.7,Lassen Peak, the largest plug dome volcano in the world, is joined by all three other types of volcanoes in this park: shield, cinder dome, and composite. Though Lassen itself last erupted in 1915, most of the rest of the park is continuously active: numerous hydrothermal features, including fumaroles, boiling pools, and bubbling mud pots, are heated by molten rock from beneath the peak.Mammoth Cave,37.18,-86.10,213.8,18123,4.5,With more than 400 miles (640 km) of passageways explored, Mammoth Cave is by far the world's longest cave system. Subterranean wildlife includes eight bat species, Kentucky cave shrimp, Northern cavefish, and cave salamanders. Above ground, the park provides recreation on the Green River, 70 miles of hiking trails, and plenty of sinkholes and springs.Mesa Verde,37.18,-108.49,210.9,14702,4.6,This area constitutes over 4,000 archaeological sites of the Ancestral Puebloan people, who lived here and elsewhere in the Four Corners region for at least 700 years. Cliff dwellings built in the 12th and 13th centuries include the famous Cliff Palace, which has 150 rooms and 23 kivas, and the Balcony House, with its many passages and tunnels.Mount Rainier,46.85,-121.75,953.5,132077,4.7,Mount Rainier, an active stratovolcano, is the most prominent peak in the Cascades, and is covered by 26 named glaciers including Carbon Glacier and Emmons Glacier, the largest in the continental United States. The mountain is popular for climbing, and more than half of the park is covered by subalpine and alpine forests. Paradise on the south slope is one of the snowiest places in the world, and the Longmire visitor center is the start of the Wonderland Trail, which encircles the mountain.North Cascades,48.70,-121.20,2042.8,10549,4.5,This complex encompasses two units of the national park itself as well as the Ross Lake and Lake Chelan National Recreation Areas. The highly glaciated mountains are spectacular examples of Cascade geology; popular hiking and climbing areas include Cascade Pass, Mount Shuksan, Mount Triumph, and Eldorado Peak.Olympic,47.97,-123.50,3733.8,26112,4.8,Situated on the Olympic Peninsula, this park straddles a diversity of ecosystems from Pacific shoreline to temperate rainforests to the alpine slopes of Mount Olympus. The scenic Olympic Mountains overlook the Hoh Rain Forest and Quinault Rain Forest, the wettest area in the continental United States.Petrified Forest,35.07,-109.78,378.5,16249,4.3,This portion of the Chinle Formation has a great concentration of 225-million-year-old petrified wood. The surrounding Painted Desert features eroded cliffs of wonderfully red-hued volcanic rock called bentonite. There are also dinosaur fossils and over 350 Native American sites.Pinnacles,36.48,-121.16,107.7,12982,4.6,Named for the eroded leftovers of a portion of an extinct volcano, the park is famous for its massive black and gold monoliths of andesite and rhyolite, which are popular with rock climbers, and a hiker's paradise of quiet trails crossing scenic Coast Range wilderness. The park is home to the endangered California condor (Gymnogyps californianus) and one of the few locations in the world where these extremely rare birds can be seen in the wild. Pinnacles also supports a dense population of prairie falcons, and more than 13 species of bat which populate its talus caves.Redwood,41.30,-124.00,455.3,186871,4.7,This park and the co-managed state parks protect almost half of all remaining coastal redwoods, the tallest trees on earth. There are three large river systems in this very seismically active area, and 37 miles (60 km) of protected coastline reveal tide pools and seastacks. The prairie, estuary, coast, river, and forest ecosystems contain a huge variety of animal and plant species.Rocky Mountain,40.40,-105.58,1075.8,439976,4.8,Bisected north to south by the Continental Divide, this portion of the Rockies has ecosystems varying from over 150 riparian lakes to montane and subalpine forests to treeless alpine tundra. Wildlife including mule deer, bighorn sheep, black bears, and cougars inhabit its igneous mountains and glacier valleys. Longs Peak, a classic Colorado fourteener, and the scenic Bear Lake are popular destinations, as well as the famous Trail Ridge Road, which reaches an elevation of more than 12,000 feet (3,700 m).Saguaro,32.25,-110.50,370.0,21299,4.6,Split into the separate Rincon Mountain and Tucson Mountain districts, this park is evidence that the dry Sonoran Desert is still home to a great variety of life spanning six biotic communities. Beyond the namesake giant saguaro cacti, there are barrel cacti, chollas, and prickly pears, as well as lesser long-nosed bats, spotted owls, and javelinas.Shenandoah,38.53,-78.35,805.5,192107,4.6,Shenandoah's Blue Ridge Mountains are covered by sprawling hardwood forests that teem with tens of thousands of animals. The Skyline Drive and Appalachian Trail run the entire length of this narrow park, along with more than 500 miles (800 km) of hiking trails passing scenic overlooks and cataracts of the Shenandoah River.Theodore Roosevelt,46.97,-103.45,285.1,11858,4.8,This region that enticed and influenced President Theodore Roosevelt consists of a park of three units in the northern badlands. Besides Roosevelt's historic cabin, there are numerous scenic drives and backcountry hiking opportunities. Wildlife includes American bison, pronghorn, bighorn sheep, and wild horses.Voyageurs,48.50,-92.88,883.0,2633,0,This park protecting four lakes near the Canadian border is a site for canoeing, kayaking, and fishing, and preserves a history populated by Ojibwe Native Americans, French fur traders called voyageurs, and ambitious gold-miners. Formed by glaciers, the region features tall bluffs, rock gardens, scenic islands and bays, and several historic buildings.Wind Cave,43.57,-103.48,114.5,8663,4.5,Wind Cave is distinctive for its calcite fin formations called boxwork and needle-like growths called frostwork. The cave, which was discovered by a sound like that of wind coming from a hole in the ground, is the world's densest cave system. Above ground is a mixed-grass prairie with animals such as bison, black-footed ferrets, and prairie dogs.[63] and ponderosa pine forests home to cougars and elk.WrangellSt. Elias,61.0,-142.00,33682.6,10790,4.0,An immense plot of mountainous country protects the convergence of the Alaska, Chugach, and Wrangell-Saint Elias Ranges, which include many of the continent's tallest mountains and volcanoes, including the 18,008-foot Mount Saint Elias. More than a quarter of the park is covered with glaciers, including the tidewater Hubbard Glacier, piedmont Malaspina Glacier, and valley Nabesna Glacier.Yellowstone,44.6,-110.5,8983.2,663554,4.6,Situated on the Yellowstone Caldera, the park has an expansive network of geothermal areas including vividly colored hot springs, boiling mud pots, and regularly erupting geysers, the best-known being Old Faithful and Grand Prismatic Spring. The yellow-hued Grand Canyon of the Yellowstone River has a number of scenic waterfalls, and four mountain ranges run through the park. More than 60 mammal species, including the gray wolf, grizzly bear, lynx, bison, and elk, make this park one of the best wildlife viewing spots in the country.Yosemite,37.83,-119.50,3080.7,689162,4.7,Among the earliest candidates for National Park status, Yosemite features towering granite cliffs, dramatic waterfalls, and old-growth forests at a unique intersection of geology and hydrology. Half Dome and El Capitan rise from the park's centerpiece, the glacier-carved Yosemite Valley, and from its vertical walls drop Yosemite Falls, North America's tallest waterfall. Three giant sequoia groves, along with a pristine wilderness in the heart of the Sierra Nevada, are home to an abundance of rare plant and animal species.